{
  "$schema": "https://json-schema.org/draft/2020-12/schema",
  "$id": "https://hy-home.k8s/schemas/agent-registry.schema.json",
  "title": "Provider-neutral agent registry",
  "type": "object",
  "additionalProperties": false,
  "required": [
    "$schema",
    "schema_version",
    "registry_id",
    "providers",
    "permission_classes",
    "skills",
    "roles"
  ],
  "properties": {
    "$schema": {"const": "./contracts/agent-registry.schema.json"},
    "schema_version": {"const": 1},
    "registry_id": {"const": "hy-home.k8s/agents"},
    "providers": {
      "type": "array",
      "minItems": 2,
      "maxItems": 2,
      "prefixItems": [
        {"$ref": "#/$defs/claudeProvider"},
        {"$ref": "#/$defs/codexProvider"}
      ],
      "items": false
    },
    "permission_classes": {
      "type": "array",
      "minItems": 3,
      "maxItems": 3,
      "items": {"$ref": "#/$defs/permissionClass"}
    },
    "skills": {
      "type": "array",
      "minItems": 1,
      "maxItems": 64,
      "items": {"$ref": "#/$defs/skill"}
    },
    "roles": {
      "type": "array",
      "minItems": 1,
      "maxItems": 64,
      "items": {"$ref": "#/$defs/role"}
    }
  },
  "$defs": {
    "claudeProvider": {
      "type": "object",
      "additionalProperties": false,
      "required": ["id", "gateway", "projection_root"],
      "properties": {
        "id": {"const": "claude"},
        "gateway": {"const": "CLAUDE.md"},
        "projection_root": {"const": ".claude/agents"}
      }
    },
    "codexProvider": {
      "type": "object",
      "additionalProperties": false,
      "required": ["id", "gateway", "projection_root"],
      "properties": {
        "id": {"const": "codex"},
        "gateway": {"const": "AGENTS.md"},
        "projection_root": {"const": ".codex/agents"}
      }
    },
    "permissionClass": {
      "type": "object",
      "additionalProperties": false,
      "required": ["id", "allows_mutation", "allows_delegation", "external_writes_require_approval"],
      "properties": {
        "id": {"enum": ["read-only-evidence", "scoped-authoring", "orchestration"]},
        "allows_mutation": {"type": "boolean"},
        "allows_delegation": {"type": "boolean"},
        "external_writes_require_approval": {"const": true}
      }
    },
    "skill": {
      "type": "object",
      "additionalProperties": false,
      "required": ["id", "path"],
      "properties": {
        "id": {"type": "string", "pattern": "^[a-z0-9]+(?:-[a-z0-9]+)*$", "maxLength": 80},
        "path": {"type": "string", "pattern": "^\\.agents/skills/[a-z0-9-]+/skill\\.md$", "maxLength": 160}
      }
    },
    "role": {
      "type": "object",
      "additionalProperties": false,
      "required": [
        "id",
        "responsibility",
        "permission_class",
        "capability_tier_ref",
        "supported_providers",
        "skill_refs",
        "handoff_to",
        "projections"
      ],
      "properties": {
        "id": {"type": "string", "pattern": "^[a-z0-9]+(?:-[a-z0-9]+)*$", "maxLength": 80},
        "responsibility": {"type": "string", "minLength": 16, "maxLength": 360},
        "permission_class": {"type": "string", "pattern": "^[a-z0-9]+(?:-[a-z0-9]+)*$"},
        "capability_tier_ref": {"type": "string", "pattern": "^docs/00\\.agent-governance/policies/model-selection\\.md#(?:top|worker)$", "maxLength": 160},
        "supported_providers": {
          "type": "array",
          "prefixItems": [{"const": "claude"}, {"const": "codex"}],
          "items": false,
          "minItems": 2,
          "maxItems": 2
        },
        "skill_refs": {
          "type": "array",
          "maxItems": 16,
          "uniqueItems": true,
          "items": {"type": "string", "pattern": "^[a-z0-9]+(?:-[a-z0-9]+)*$"}
        },
        "handoff_to": {
          "type": "array",
          "maxItems": 32,
          "uniqueItems": true,
          "items": {"type": "string", "pattern": "^[a-z0-9]+(?:-[a-z0-9]+)*$"}
        },
        "projections": {
          "type": "object",
          "additionalProperties": false,
          "required": ["neutral", "claude", "codex"],
          "properties": {
            "neutral": {"type": "string", "pattern": "^\\.agents/agents/[a-z0-9-]+\\.md$"},
            "claude": {"type": "string", "pattern": "^\\.claude/agents/[a-z0-9-]+\\.md$"},
            "codex": {"type": "string", "pattern": "^\\.codex/agents/[a-z0-9-]+\\.toml$"}
          }
        }
      }
    }
  }
}
